"_id","name","preview","link","category"
"60739f76938b66c4e83a516f","Birth Control","Birth control is how you prevent pregnancy. There are lots of different birth control options out there. We&#39;re here to help you figure it all out.","https://www.plannedparenthood.org/learn/birth-control","Birth Control"
"60739f76938b66c4e83a5170","How Do I Get Birth Control Pills","The pill is easy to get, but you need a prescription. Here’s the scoop on where to get birth control pills, how much they cost, and how you might be able to get them for free or low cost.","https://www.plannedparenthood.org/learn/birth-control/birth-control-pill/how-do-i-get-birth-control-pills","Birth Control"
"60739f76938b66c4e83a5171","How to Figure Out Which Birth Control Method is Right for You","If there’s anything harder than figuring out what to eat at Cheesecake Factory or which vibrator to add to your collection, it’s figuring out which birth control option is right for you.","https://www.healthline.com/health/birth-control/methods","Birth Control"
"60739f76938b66c4e83a5172","What are the Disadvantages of the Pill","Remembering to take a pill every day can be hard. And some people get side effects that bother them (but they usually go away in a few months).","https://www.plannedparenthood.org/learn/birth-control/birth-control-pill/what-are-the-disadvantages-of-the-pill","Birth Control"
"60739f76938b66c4e83a5173","Birth Control Implant","A contraceptive implant is a type of hormonal birth control. In the United States, it’s sold under the brand name Nexplanon. It was previously available under the name Implanon.","https://www.healthline.com/health/birth-control-implant","Birth Control"